{
  "schema": "avd-assess-evidence/v1",
  "id": "2026-10-21-estate-single-user-example",
  "source": "estate",
  "submitted": "2026-10-21",
  "consent": true,
  "window": {
    "days": 7,
    "hours": "peak",
    "coverage": 0.9
  },
  "scope": {
    "class": "power",
    "hostPoolType": "personal",
    "hostsBand": "1-9",
    "usersBand": "1-9",
    "vcpuPerHost": 8,
    "memoryGiBPerHost": 56
  },
  "metrics": [
    {
      "metric": "input-delay-session",
      "unit": "ms",
      "p95": 90,
      "verdict": "agrees"
    }
  ]
}
